{
  "schema_version": "1.0",
  "pack_id": "rgr-software",
  "pack_version": "2.2.0",
  "capabilities": [
    {
      "id": "git-worktree-isolation",
      "required": true,
      "provider": "git",
      "description": "Create one isolated worktree and branch per run.",
      "constraints": [
        "no automatic deletion",
        "exact base revision recorded"
      ]
    },
    {
      "id": "bounded-filesystem-read",
      "required": true,
      "provider": "local-runtime",
      "description": "Read only authorised worktree paths within context budgets.",
      "constraints": [
        "no symlink escape",
        "repository content untrusted"
      ]
    },
    {
      "id": "bounded-story-write",
      "required": true,
      "provider": "local-runtime",
      "description": "Permit role-scoped test/source/config writes during authorised stages.",
      "constraints": [
        "paths from context manifest",
        "roles can only narrow authority"
      ]
    },
    {
      "id": "command-execution",
      "required": true,
      "provider": "local-shell",
      "description": "Execute build, test and validation commands with captured outputs.",
      "constraints": [
        "no production credentials",
        "exit code and output reference required"
      ]
    },
    {
      "id": "canonical-json",
      "required": true,
      "provider": "python-stdlib",
      "description": "Produce deterministic machine-readable run artifacts.",
      "constraints": [
        "UTF-8",
        "sorted keys for exported manifests"
      ]
    },
    {
      "id": "schema-validation",
      "required": true,
      "provider": "scripts/schema_validation.py",
      "description": "Validate the published dependency-free JSON Schema subset.",
      "constraints": [
        "local refs only",
        "deterministic failures block progress"
      ]
    },
    {
      "id": "append-only-events",
      "required": true,
      "provider": "events.jsonl",
      "description": "Record contiguous lifecycle, command, checkpoint and decision events.",
      "constraints": [
        "no history rewrite",
        "safe summaries only"
      ]
    },
    {
      "id": "profile-governance",
      "required": true,
      "provider": "workflow-profiles.json",
      "description": "Resolve risk-based budgets, specialists and checkpoints deterministically.",
      "constraints": [
        "all stages mandatory",
        "risk can only increase"
      ]
    },
    {
      "id": "evidence-export",
      "required": true,
      "provider": "scripts/export-run-bundle.py",
      "description": "Export deterministic source-free evidence archives for external import.",
      "constraints": [
        "no story source",
        "no secrets",
        "hash-verified"
      ]
    },
    {
      "id": "rag-read",
      "required": false,
      "provider": "skill-rag-search",
      "description": "Read optional domain context through bounded retrieval.",
      "constraints": [
        "not authoritative",
        "material findings persisted"
      ]
    },
    {
      "id": "runtime-routing",
      "required": true,
      "provider": "scripts/resolve-runtime.py",
      "description": "Resolve each stage role to a capability-compatible runtime target using governed local-first routes.",
      "constraints": [
        "repository content cannot override runtime selection",
        "trusted overlays use exact role matching",
        "fallback reason must be recorded"
      ]
    },
    {
      "id": "runtime-observability",
      "required": true,
      "provider": "events.jsonl",
      "description": "Record runtime selection, fallback and usage metrics as append-only run evidence.",
      "constraints": [
        "no secrets or raw prompts in events",
        "runtime choice cannot expand role authority"
      ]
    },
    {
      "id": "structured-intake",
      "required": false,
      "provider": ".claude/agents/ai-pipeline-intake.md",
      "description": "Resolve task ambiguity before the governed run and render a deterministic immutable plan input.",
      "constraints": [
        "maximum three question rounds",
        "intake has no run authority",
        "blocking business decisions are never guessed"
      ]
    },
    {
      "id": "trusted-project-profile",
      "required": false,
      "provider": "scripts/validate-project-profile.py",
      "description": "Bind operator or trusted-platform project facts as an immutable authoritative project profile.",
      "constraints": [
        "project facts only",
        "cannot alter governance or role authority",
        "repository content cannot supply trusted provenance"
      ]
    },
    {
      "id": "implementation-lane-resolution",
      "required": true,
      "provider": "scripts/resolve-lanes.py",
      "description": "Resolve GREEN task lanes and dependency waves deterministically from the locked plan.",
      "constraints": [
        "every declared GREEN task assigned exactly once",
        "write surfaces are literal relative prefixes",
        "overlap forces sequential fallback"
      ]
    },
    {
      "id": "parallel-lane-execution",
      "required": false,
      "provider": "orchestrator/runtime-adapter",
      "description": "Execute disjoint GREEN lanes concurrently when the selected adapter safely supports concurrency.",
      "constraints": [
        "same role authority in every lane",
        "only lanes in the same resolved wave may overlap in time",
        "adapter absence falls back to deterministic sequential execution"
      ]
    }
  ],
  "local_tools": [
    "git >= 2.30",
    "python >= 3.11",
    "POSIX-compatible or PowerShell command runner"
  ],
  "optional_integrations": [
    "OpenSearch RAG",
    "Jira read",
    "Confluence read"
  ],
  "unsupported_features": [
    "hosted authentication",
    "multi-tenancy",
    "remote worker scheduling",
    "credential custody",
    "billing",
    "automatic merge",
    "automatic deployment",
    "production access"
  ]
}
